{
  "schemaVersion": 1,
  "id": "disorderlaucher.default.light",
  "name": "Default Light",
  "mode": "light",
  "colors": {
    "background": "#ECECE8",
    "surface": "#F8F8F5",
    "surfaceAlt": "#DFDFDB",
    "surfaceRaised": "#CFCFCA",
    "textPrimary": "#0A0A0A",
    "textSecondary": "#62625E",
    "border": "#C8C8C2",
    "borderStrong": "#9E9E98",
    "action": "#101010",
    "actionText": "#F4F4EF"
  },
  "typography": {
    "displayFamily": "Space Grotesk",
    "bodyFamily": "IBM Plex Sans",
    "scale": 1.0
  },
  "shape": {
    "inputRadius": 7,
    "buttonRadius": 8,
    "cardRadius": 13,
    "heroRadius": 18
  },
  "density": {
    "uiScale": 1.0,
    "compact": false
  },
  "effects": {
    "shadowStrength": 0.2,
    "animations": true
  }
}